gem_id,gem_parent_id,concept_set_id,concepts,target,references
common_gen-validation-598,common_gen-validation-598,598,"['dog', 'hold', 'leash', 'mouth']",The dog can hold the leash in his mouth.,"['The dog can hold the leash in his mouth.', 'The dog held the leash in its mouth.', ""Don't hold that dog by the mouth, Pedro, it's much better to use a leash."", 'The dog is holding a leash in its mouth.']"
common_gen-validation-599,common_gen-validation-599,599,"['car', 'night', 'push', 'street']",Push the car on the street at night.,"['Push the car on the street at night.', 'A man pushes his dead car down the street at night.', 'My car broke down the other night so I had to push it down the street to get it out of the way of traffic.', 'A man drives a car on a street during the late night hours, pushing away problems he left behind.', 'two people push a car down a quiet street at night']"
common_gen-validation-600,common_gen-validation-600,600,"['bird', 'eat', 'food', 'hand']",The bird will eat food from the girl's hand.,"[""The bird will eat food from the girl's hand."", 'A child allowed a bird to eat food out of her hand.', ""The bird will eat food out of the woman's hand."", ""A small bird eats food from someone's hand. ""]"
common_gen-validation-601,common_gen-validation-601,601,"['game', 'player', 'team', 'watch']",The man watched the player in the game as the team won.,"['The man watched the player in the game as the team won.', 'The team cheered on the players as they were watching the game.', 'the player watch the time as he thought about how he would win the game for his team', 'american football player watches the game against sports team']"
common_gen-validation-602,common_gen-validation-602,602,"['pit', 'run', 'track', 'watch']","Iam going to watch my son, run his car around the track and to stop at the pit","['Iam going to watch my son, run his car around the track and to stop at the pit', 'The man set in the pit and watched the people run around the track.', 'The track team started to run, they made sure to watch their footing due to the weather but one of them slipped and fell in a pit.', 'An audience watching pans out into a large track and athletes running into a pit.']"
common_gen-validation-603,common_gen-validation-603,603,"['apple', 'bag', 'pick', 'tree']",I pick the apples from the tree and put them in the bag.,"['I pick the apples from the tree and put them in the bag.', 'A person was picking apples from a tree and putting them into their bag.', 'The children picked apples from the trees and put them in the bag.', 'A girl picks apples from a tree and puts in a bag.', 'A girl holding a bag is picking apples under an apple tree.']"
common_gen-validation-604,common_gen-validation-604,604,"['blow', 'blower', 'leave', 'pile']",Dad uses the powerful blower to blow all of the extra leaves into a big pile.,"['Dad uses the powerful blower to blow all of the extra leaves into a big pile.', 'I plugged in the electric leaf blower to blow the leaves into a pile.', ""The man stood and looked at the grass and leaves on his driveway, he couldn't leave the mess there so he got the blower out of the garage and used it to blow the grass and leaves into a pile."", 'Men uses blower to blow the cement sand mixture into pile foundation and leave it cure over a period of time.', 'A man with a leaf blower blows a large pile of leaves']"
common_gen-validation-605,common_gen-validation-605,605,"['clap', 'floor', 'hand', 'sit']",The teacher clapped her hands to get the children's attention to sit on the floor.,"[""The teacher clapped her hands to get the children's attention to sit on the floor."", 'As we sat in our seats the cast came out on the floor and we clapped our hands.', 'The audience sat on the floor while clapping their hands.', 'Children are sitting on the floor, clapping their hands for a game.', 'A little kid sitting on the floor and clapping her hands']"
common_gen-validation-606,common_gen-validation-606,606,"['bottle', 'egg', 'suck', 'yolk']",I suck the egg yolk out of the bottle.,"['I suck the egg yolk out of the bottle.', 'After the boy can suck the yolk out of the egg, he can put the yolk in a bottle.', 'To separate the yolk from the egg white, you crack the egg into a bowl and squeeze a bottle to suck up the yolk.', 'The athlete sucked the egg yolk out of the bottle.', 'A egg is shown as the yolk is sucked into the bottle.']"
common_gen-validation-607,common_gen-validation-607,607,"['base', 'baseball', 'hit', 'run']",A baseball player hits the ball and runs to the first base.,"['A baseball player hits the ball and runs to the first base.', 'The man hits the baseball and runs to first base.', 'The man will hit the baseball and run to the base.', 'Jake never hit a baseball before, but when he stood on that base and hit that ball he had no choice but to make a home run.', 'A young boy hits a baseball and runs to first base.']"
common_gen-validation-608,common_gen-validation-608,608,"['bench', 'break', 'sit', 'take']",Take a break and sit on the bench,"['Take a break and sit on the bench', 'The woman takes a break and sits on the bench.', 'The older man took a break and sat on the bench.', 'A man at work can sit on the bench when he wants to take a break.', 'Older ladies taking a break whilst sitting on the bench.']"
common_gen-validation-609,common_gen-validation-609,609,"['boat', 'hold', 'pull', 'rope']",The man pulled the rope to hold the anchor of his boat out of the water.,"['The man pulled the rope to hold the anchor of his boat out of the water.', 'One man held the boat while the other man pulled the rope tight.', 'The man did not know if he could pull the boat on one rope and hold another.', 'hold the rope and pull the boat.', 'People water ski holding a ski ropes that are pulled by a boat.']"
common_gen-validation-610,common_gen-validation-610,610,"['drill', 'hole', 'piece', 'wood']",The man used a drill to put a hole in the piece of wood.,"['The man used a drill to put a hole in the piece of wood.', 'Drill a hole in a piece of wood.', 'The man will drill a hole in the piece of wood.', 'drilling a hole in a piece of wood']"
common_gen-validation-611,common_gen-validation-611,611,"['ride', 'surfboard', 'wave', 'wetsuit']",I needed to put on my wetsuit so I could ride the the surfboard on the ocean wave.,"['I needed to put on my wetsuit so I could ride the the surfboard on the ocean wave.', 'I will put on my wetsuit and ride a big wave on my surfboard!', 'A surfer wears a wetsuit to ride a wave on a surfboard in the ocean.', 'Ride a surfboard into a wave and wear a wetsuit to surf.', 'The surfer donned a wetsuit, grabbed his surfboard and rode the waves.', 'Two men wearing wetsuits riding a wave on surfboards.']"
common_gen-validation-612,common_gen-validation-612,612,"['give', 'instruction', 'knife', 'sharpen']",The first thing the cooking teacher did was give her students instruction on how to sharpen a knife.,"['The first thing the cooking teacher did was give her students instruction on how to sharpen a knife.', 'The man will give instructions to the boys on how to sharpen a knife.', 'The butcher gave instructions on how to sharpen the knife.', 'A video giving instructions on how to properly sharpen a knife.']"
common_gen-validation-613,common_gen-validation-613,613,"['bride', 'groom', 'picture', 'take']",The photographer took a picture of the bride and groom.,"['The photographer took a picture of the bride and groom.', 'The bride and the groom will take a picture.', 'A woman took a picture of the bride and groom.', 'The groom and bride taking a picture.']"
common_gen-validation-614,common_gen-validation-614,614,"['blow', 'bubble', 'chew', 'gum']",A child chewing gum blows bubbles.,"['A child chewing gum blows bubbles.', 'He will blow a bubble once he has chewed the gum.', 'The boy put the gum in his mouth, chewed it for a bit, then blew a big bubble that popped onto his face.', 'I am blowing a bubble while you chew gum.', 'He is blowing a bubble with chewing gum.']"
common_gen-validation-615,common_gen-validation-615,615,"['hand', 'head', 'rest', 'sit']",Jimmy rests his head on his hand when he sits at his desk.,"['Jimmy rests his head on his hand when he sits at his desk.', 'The teacher sat at the desk and rested her head in her hand.', 'The girl rested her hand on her head as she sat at her desk.', 'Someone sits with his head resting on his hands.']"
common_gen-validation-616,common_gen-validation-616,616,"['shirt', 'sit', 'table', 'wear']",The man put on a shirt to wear so that he could sit down at the restaurant table for dinner.,"['The man put on a shirt to wear so that he could sit down at the restaurant table for dinner.', 'A man wearing a shirt sits down at the table.', 'I sit at a table and wear a shirt.', 'The woman wears a blue shirt as she sits at the table.', 'A man sat at the table wearing his best shirt.', 'A woman sitting at a table wearing a black shirt.']"
common_gen-validation-617,common_gen-validation-617,617,"['chair', 'leg', 'sit', 'wax']","While sitting on the floor, the girl will wax the chair leg.","['While sitting on the floor, the girl will wax the chair leg.', 'She used to sit down in a chair at the salon and put her leg up for them to wax it', 'I sit on a chair while I wax my leg.', 'Sit in the chair so they can wax your legs.', 'A man is sitting in a chair getting his leg waxed.']"
common_gen-validation-618,common_gen-validation-618,618,"['board', 'iron', 'iron', 'shirt']",A woman uses an iron and a board to iron a shirt.,"['A woman uses an iron and a board to iron a shirt.', 'The lady is ironing the shirt with the iron on the ironing board.', 'i iron the shirts on the board', 'A man took the iron board out early, knowing he would need to iron his shirt in a few hours.', 'He takes out the iron board to iron his shirt.', 'A man pressing a shirt using an iron on a ironing board.']"
common_gen-validation-619,common_gen-validation-619,619,"['fish', 'hole', 'ice', 'pull']",A man pulls the fish from the hole in the ice.,"['A man pulls the fish from the hole in the ice.', 'The man pulled the fish out of the hole in the ice.', 'A man demonstrates pulling a fish out of a hole of ice.']"
common_gen-validation-620,common_gen-validation-620,620,"['bowl', 'cereal', 'eat', 'table']",Please put the bowl on the table when you are finished eating the cereal.,"['Please put the bowl on the table when you are finished eating the cereal.', 'She will eat her cereal from a bowl at the table.', 'My mother put a bowl of cereal on the table for me to eat.', 'The bowl on the table has some cereal the baby eats.', 'A boy eating cereal from a bowl at a table.']"
common_gen-validation-621,common_gen-validation-621,621,"['friend', 'joke', 'laugh', 'tell']",The woman tells her friends a joke and they all laugh loudly.,"['The woman tells her friends a joke and they all laugh loudly.', 'The boy wanted to tell his friend a joke to make him laugh.', 'The boy laughed too loud in class because his friend told him a joke.', 'A woman laughs at a joke her friend told.']"
common_gen-validation-622,common_gen-validation-622,622,"['ceremony', 'foot', 'priest', 'wash']","At the ceremony, the priest washed one foot in water.","['At the ceremony, the priest washed one foot in water.', 'The priest washes the feet of his parishioners in a ceremony for this purpose.', ""The woman's foot begin to hurt at the ceremony right after the priest went to wash his hands."", ""A priest holding a ceremony where he washes man's feet.""]"
common_gen-validation-623,common_gen-validation-623,623,"['perform', 'ride', 'skateboard', 'trick']",The teenager performed a trick while riding on his skateboard.,"['The teenager performed a trick while riding on his skateboard.', 'My friend rides his skateboard on a rail and performs tricks.', 'The boy rode the skateboard and performed a trick.', 'A man riding a skateboard performs a trick.']"
common_gen-validation-624,common_gen-validation-624,624,"['brush', 'clean', 'toilet', 'use']",People use a scrub brush to clean the toilet.,"['People use a scrub brush to clean the toilet.', 'The tall man uses a brush to clean the toilet.', 'A person can use a brush to clean a toilet.', 'I used the brush to clean the toilet.', 'A man uses a toilet brush to thoroughly clean a toilet.']"
common_gen-validation-625,common_gen-validation-625,625,"['block', 'goalie', 'shot', 'team']",The goalie blocked the shot that would have won the team the game.,"['The goalie blocked the shot that would have won the team the game.', 'The goalie blocked the shot for his team.', 'Centiennial Highschool""s new goalie can really block a shot coming from any opposing team.', 'Goalie in a hockey game blocking a shot by another team.']"
common_gen-validation-626,common_gen-validation-626,626,"['block', 'chainsaw', 'cut', 'ice']",The ice sculpture artist started cutting his ice block with the chainsaw.,"['The ice sculpture artist started cutting his ice block with the chainsaw.', 'The artist cuts a design into the block of ice with a chainsaw.', 'Someone is using a chainsaw to cut blocks of ice.']"
common_gen-validation-627,common_gen-validation-627,627,"['chase', 'dog', 'run', 'track']",The dog ran fast as it chased the rabbit around the track.,"['The dog ran fast as it chased the rabbit around the track.', 'A boy ran down the track while being chased by a dog.', 'We watched that dog run around the track for 20 minutes chasing his own tail.', 'Three dogs running on a racing track chasing a rabbit.']"
common_gen-validation-628,common_gen-validation-628,628,"['microphone', 'shirt', 'singe', 'wear']",the man singe his shirt while speaking into the wear microphone,"['the man singe his shirt while speaking into the wear microphone', 'The microphone clipped to his shirt burst into flames and singed a hole in his attire, he would need to wear something else this evening.', 'She will wear the shirt that has the microphone on it with the singe at the bottom.', 'Girl wearing blue shirt singing into microphone']"
common_gen-validation-629,common_gen-validation-629,629,"['kid', 'knife', 'pumpkin', 'throw']",A kid can use a knife to carve a pumpkin and then throw pumpkin in the trash after Halloween.,"['A kid can use a knife to carve a pumpkin and then throw pumpkin in the trash after Halloween.', 'The kid can throw a knife at the pumpkin.', 'The kid wanted to throw the knife at the orange pumpkin', 'A little kid is shown throwing a knife at a pumpkin.']"
common_gen-validation-630,common_gen-validation-630,630,"['bike', 'kid', 'ride', 'street']",The kid rode the bike down the street.,"['The kid rode the bike down the street.', 'The kid rode his bike down the street.', 'A kid can ride his bike down this street.', 'A kid rides his bike into a street.']"
common_gen-validation-631,common_gen-validation-631,631,"['building', 'picture', 'take', 'tourist']",Tourists take a lot of pictures of the beautiful building.,"['Tourists take a lot of pictures of the beautiful building.', 'The tourist takes a picture of the building.', 'The tourist will take a picture of the building.', 'Tourist taken pictures at a building in China.']"
common_gen-validation-632,common_gen-validation-632,632,"['floor', 'paper', 'piece', 'sit']",A woman sits on the floor and examines a piece of paper.,"['A woman sits on the floor and examines a piece of paper.', 'The puppy was taught to sit on the piece of paper on the floor.', 'The child sits on the floor and draws on a piece of paper.', 'A boy sits on the floor and folds a piece of paper.']"
common_gen-validation-633,common_gen-validation-633,633,"['barbell', 'ground', 'head', 'lift']","I lifted the barbell, through it at his head, and he fell to the ground.","['I lifted the barbell, through it at his head, and he fell to the ground.', 'The man lifts the barbell from the ground while making sure that his head is facing the mirror so he can check his form.', 'As i lift the barbell over my head I keep my feet on the ground.', 'The weightlifter lifts the barbell from the ground up to his head.', 'A man lifts a barbell over his head and then drops it to the ground.']"
common_gen-validation-634,common_gen-validation-634,634,"['arrow', 'bow', 'shoot', 'target']",The archer pulled on the bow shooting the arrow  against the target butt.,"['The archer pulled on the bow shooting the arrow  against the target butt.', 'The man shot the arrow with his bow at the target.', 'The man at the shooting range shot his target with his bow and arrow.', 'A boy shoots a bow and arrow at a target.']"
common_gen-validation-635,common_gen-validation-635,635,"['carve', 'piece', 'tool', 'wood']",The man uses his tool to carve a piece of wood.,"['The man uses his tool to carve a piece of wood.', 'A man would use this metal tool to carve the wood piece by piece', 'The artist used his tools to carve the piece of wood.', 'A person is using tools to carve a piece of wood.']"
common_gen-validation-636,common_gen-validation-636,636,"['ball', 'knock', 'pin', 'throw']",A man throws the ball down the lane to knock all the pins down.,"['A man throws the ball down the lane to knock all the pins down.', 'Knock and throw the ball hard to pin it to the ground.', 'The man throws the ball and knocks all of the pin.', 'He throws the ball, knocking down pins.']"
common_gen-validation-637,common_gen-validation-637,637,"['lay', 'leg', 'table', 'wax']",The girl lays her leg on the table to have it waxed.,"['The girl lays her leg on the table to have it waxed.', 'She would lay her leg upon the table but had to be cautious to not knock over the candle wax.', 'My sister laid the candle down on the table and the wax dripped all down the leg.', 'a man is laying on a table getting his legs waxed.']"
common_gen-validation-638,common_gen-validation-638,638,"['balloon', 'blow', 'hat', 'wear']","The man blowing up balloons, likes to wear a large hat.","['The man blowing up balloons, likes to wear a large hat.', 'The clown was wearing a flowerpot as a hat while he blew up the balloon.', 'The clown was wearing a funny hat, and blowing balloons during the party.', 'The girl wearing a paper hat is blowing up a balloon as it is her birthday.', 'A child wearing a hat is blowing air in to a red balloon']"
common_gen-validation-639,common_gen-validation-639,639,"['dance', 'front', 'perform', 'routine']",The girl performed her dance routine in front of the audience.,"['The girl performed her dance routine in front of the audience.', ""Performing a dance in front of the bus stand is Anne's daily routine to make money."", 'The girls will perform their dance routine in front of a large crowd.', 'Someone is performing a belly dancing routine, in front of a crowd.']"
common_gen-validation-640,common_gen-validation-640,640,"['dog', 'pull', 'sle', 'snow']",The dog pulls the sled through the snow,"['The dog pulls the sled through the snow', 'The dog likes to sle through the snow while being pulled by his owner.', 'He ran with the dog in the snow as he let it pull the sle.', 'Dogs pull a sled in the snow.']"
common_gen-validation-641,common_gen-validation-641,641,"['field', 'fly', 'kite', 'run']",The children ran as they flew the kite in the field.,"['The children ran as they flew the kite in the field.', 'The woman flies her kite as she runs through the field.', ""Let's go to the field and run around and fly our kite."", 'The boy runs fast so that he can fly his kite in the field next to his house.', 'The woman told her the girl to run with the kite across the field to get it to fly.', 'A person running on a field flying a kite.']"
common_gen-validation-642,common_gen-validation-642,642,"['couch', 'sit', 'television', 'watch']",A boy spent the evening sitting on the couch and watching a documentary on television.,"['A boy spent the evening sitting on the couch and watching a documentary on television.', 'The family sits on the couch and watches television.', 'The group of teenagers sit on the couch and watch television.', 'I sit on the couch and watch television.', 'Two boys sit on the couch watching television.']"
common_gen-validation-643,common_gen-validation-643,643,"['board', 'dart', 'throw', 'wall']",This arcade has a dart board hanging on the wall that you can throw darts at.,"['This arcade has a dart board hanging on the wall that you can throw darts at.', 'A man threw a dart at the board on the wall.', 'Throw towards the dart board that hangs on the wall.', 'He throws darts at a dart board on the wall.']"
common_gen-validation-644,common_gen-validation-644,644,"['paper', 'pencil', 'piece', 'write']",Give that girl a piece of paper and a pencil and she will write you a love letter; that's the kind of girl she is.,"[""Give that girl a piece of paper and a pencil and she will write you a love letter; that's the kind of girl she is."", 'The student took a piece of paper and wrote notes with his pencil.', 'A man wrote his name in a piece of paper using a pencil', 'The boy will use a piece of paper and a pencil to write his assignment.', 'A young girl is writing on a piece of paper with a purple pencil.']"
common_gen-validation-645,common_gen-validation-645,645,"['ball', 'goal', 'kick', 'player']",When the worst player kicked the ball into the goal the crowd went insane.,"['When the worst player kicked the ball into the goal the crowd went insane.', 'The player will kick a goal with the soccer ball.', 'A player is planning to kick the ball into the goal.', 'I knew a great soccer player who during a soccer game could kick the ball in the goal from half way down the field.', 'a soccer player kicking a ball into a goal']"
common_gen-validation-646,common_gen-validation-646,646,"['beard', 'razor', 'trim', 'use']",I use a razor to trim the beard.,"['I use a razor to trim the beard.', 'John is able to use the razor to trim his beard.', 'He had been working out bush for weeks, as the man looked at himself in the mirror he thought, ""time to use the razor and trim this beard"", he couldn\'t let his family see him looking scruffy.', 'TODAY I USE MY RAZOR AND I TRIM MY BEARD', 'A man trims his beard using a razor.', 'The man uses his razor to trim his face and beard.']"
common_gen-validation-647,common_gen-validation-647,647,"['ball', 'bat', 'hold', 'throw']",The coach taught the kids how to throw the ball and hold the bat.,"['The coach taught the kids how to throw the ball and hold the bat.', 'The pitchers throws the ball at the man who holds the bat.', 'Small child holding a baseball bat with man throwing ball. ']"
common_gen-validation-648,common_gen-validation-648,648,"['give', 'instruction', 'tie', 'tie']",He likes to give instructions to he's son to tie he's tie.,"[""He likes to give instructions to he's son to tie he's tie."", 'Grandpa gives his grandson careful instruction about how to tie his tie before the big dance.', 'The mother gives instructions to her son to tie his shoes and he ties his shoes.', 'I give you instructions on how to tie a tie.', 'A father gives his son instructions on how to tie a tie as the finishing touch to his suit.', 'A man is giving instructions to tie a bow tie']"
common_gen-validation-649,common_gen-validation-649,649,"['hair', 'lay', 'sink', 'wash']",When the woman lays her head down on the sink the stylist can wash her hair.,"['When the woman lays her head down on the sink the stylist can wash her hair.', 'she laid back in her chair, allowing her hair to fall into the sink so her barber could wash it.', 'The woman laid back in the salon chair, letting the hairdresser wash her hair in the sink.', 'A woman washes her hair in the sink and lays down to rest.', 'A woman lays back in a sink as another woman washes her hair.']"
common_gen-validation-650,common_gen-validation-650,650,"['bench', 'hat', 'sit', 'wear']",The man doesn't wear his hat while sitting on the bench in the park.,"[""The man doesn't wear his hat while sitting on the bench in the park."", 'The man wearing the hat sits on the bench.', 'He used to sit on the bench outside and wear his hat.', 'Hat wearing man is sitting on the bench.', 'A man wearing a hat sitting on a bench.']"
common_gen-validation-651,common_gen-validation-651,651,"['arm', 'ball', 'hand', 'roll']",Once he caught the ball in his hand he took a hard roll onto the pavement and broke his arm.,"['Once he caught the ball in his hand he took a hard roll onto the pavement and broke his arm.', 'The juggler rolled the ball down his arm into his hand.', 'The boy swings his arm and the ball rolls from his hand.', 'A boy rolling a small ball in his arms and hands with music playing']"
common_gen-validation-652,common_gen-validation-652,652,"['dance', 'listen', 'music', 'room']",A boy danced around the room while listening to music.,"['A boy danced around the room while listening to music.', 'The man loves to listen to music and dance in his room.', 'The woman will dance and listen to music in this room.', 'a man dancing in a ballet room while listening to music.']"
common_gen-validation-653,common_gen-validation-653,653,"['bench', 'building', 'front', 'sit']",The older man sat on the bench in front of the building.,"['The older man sat on the bench in front of the building.', ""A woman sit's at the bench in the front of the building."", 'We will sit on that bench in front of the building.', 'a wooden bench sits in front of a building ']"
common_gen-validation-654,common_gen-validation-654,654,"['cut', 'knife', 'pumpkin', 'top']",He cuts the top of the pumpkin with a knife.,"['He cuts the top of the pumpkin with a knife.', 'During October, people carve pumpkins with a knife by cutting their top off and removing the insides.', 'A woman used a knife to cut the top off the pumpkin.', 'The chef cut off the top of the pumpkin with a knife to make a jack-o-lantern.', 'A knife cuts the top of a pumpkin.']"
