gem_id,gem_parent_id,concept_set_id,concepts,target,references
common_gen-validation-317,common_gen-validation-317,317,"['head', 'shake', 'watch']",I shook my head as I watched my friend accidentally walk into a pole.,"['I shook my head as I watched my friend accidentally walk into a pole.', 'I shaked by head in disbelief as i watched Brazil trounced by Germany.', 'The boy watched the dog shake its head after the storm.', 'Someone watches someone go and slowly shakes her head.']"
common_gen-validation-318,common_gen-validation-318,318,"['competition', 'dance', 'perform']",There is a dance competition where the little girl has to perform her routine,"['There is a dance competition where the little girl has to perform her routine', ""The girl is practicing for the upcoming dance competition and I'm confident she will perform well."", 'The woman was about to perform in the dance competition', 'Four people perform a dance for a competition.']"
common_gen-validation-319,common_gen-validation-319,319,"['body', 'raft', 'water']",The man uses a raft to move around in the big body of water,"['The man uses a raft to move around in the big body of water', 'The raft sailed for hours on the body of water.', 'We see his body on the raft as it drifts on the water.', 'an elephant on a raft in a body of water']"
common_gen-validation-320,common_gen-validation-320,320,"['background', 'front', 'stand']",The girl wanted to stand in the front of the stage but was placed in the background.,"['The girl wanted to stand in the front of the stage but was placed in the background.', 'A woman is standing in front of a background.']"
common_gen-validation-321,common_gen-validation-321,321,"['baseball', 'field', 'kid']",The kid ran into the field to catch a baseball.,"['The kid ran into the field to catch a baseball.', 'A kid is playing a game on a baseball field.', 'The kid hit the baseball in the field.', 'kids are playing baseball in a field.']"
common_gen-validation-322,common_gen-validation-322,322,"['hand', 'head', 'put']",The man put his hand on his head.,"['The man put his hand on his head.', 'The men put hands on the heads of the boys.', ""His hand slid under his mother's head and he put her gently back into her bed."", 'He puts a hand to his head.']"
common_gen-validation-323,common_gen-validation-323,323,"['house', 'look', 'window']",The boy looked out of the window sadly because the rain kept him inside the house.,"['The boy looked out of the window sadly because the rain kept him inside the house.', 'The girl looks out the window of the house.', 'The man took a look through the window into the house', 'woman looks from the windows of her house']"
common_gen-validation-324,common_gen-validation-324,324,"['hold', 'room', 'walk']",a man holds the door for the next person as they walk in the room,"['a man holds the door for the next person as they walk in the room', 'I held my phone while I walked around the room.', 'A woman walks by the exercise room holding weights.']"
common_gen-validation-325,common_gen-validation-325,325,"['blow', 'bubble', 'wand']",The child uses the bubble wand to blow bubbles.,"['The child uses the bubble wand to blow bubbles.', 'The boy played with the bubble wand outside to blow bubbles.', 'The little girl was trying to blow bubbles using her bubble wand.', 'A girl is blowing a bubble with a wand.']"
common_gen-validation-326,common_gen-validation-326,326,"['drill', 'piece', 'wood']",The construction workers could not drill the piece into the wood.,"['The construction workers could not drill the piece into the wood.', 'He used a drill to connect two pieces of wood.', 'drilling a hole in a piece of wood']"
common_gen-validation-327,common_gen-validation-327,327,"['ball', 'court', 'pass']",The ball was meant to pass the court and not hit it.,"['The ball was meant to pass the court and not hit it.', 'The basketball player passes the ball across the court to his teammate.', 'They are constantly bouncing the ball on the court, looking for a clean pass.', 'A man walks off the court passing a ball.']"
common_gen-validation-328,common_gen-validation-328,328,"['singe', 'singer', 'song']",The singer sings a song but singed her hair on a candle.,"['The singer sings a song but singed her hair on a candle.', 'Singer singing a song to someone']"
common_gen-validation-329,common_gen-validation-329,329,"['ball', 'hit', 'turn']",a man hit ball and turn,"['a man hit ball and turn', 'When it was the baseball players turn at bat, he hit the ball.', 'When its her turn she must hit the ball and run to base.', 'both men take turns hitting the ball.']"
common_gen-validation-330,common_gen-validation-330,330,"['catch', 'fish', 'pole']",A man can catch fish with a fishing pole.,"['A man can catch fish with a fishing pole.', 'The man used a fishing pole to catch fish.', 'A woman has caught a fish with a fishing pole.']"
common_gen-validation-331,common_gen-validation-331,331,"['car', 'garage', 'work']",The man worked on his car in the garage all afternoon.,"['The man worked on his car in the garage all afternoon.', 'A man works on his car in the garage.', 'After work I park the car in the garage.', 'Guys working on cars inside a garage.']"
common_gen-validation-332,common_gen-validation-332,332,"['cut', 'kitchen', 'meat']",A person cut meat in the kitchen.,"['A person cut meat in the kitchen.', 'The meat is being cut in the kitchen.', 'Use the kitchen knife to cut the meat.', 'A man cuts meat in a kitchen.']"
common_gen-validation-333,common_gen-validation-333,333,"['ride', 'stand', 'wave']",He stands on he's board while riding the wave.,"[""He stands on he's board while riding the wave."", 'You have to stand on the surf board in order to ride the wave.', ""The surfer wanted to ride a wave but couldn't stand on the surfboard."", 'A surfer stands while she rides a wave.']"
common_gen-validation-334,common_gen-validation-334,334,"['head', 'shake', 'walk']",The man shook his head while walking away.,"['The man shook his head while walking away.', 'A boy is walking through the sidewalks and shakes his head according to the music from his headphone.', 'The man shook his head as he took a walk.', 'He shakes his head, then walks out.']"
common_gen-validation-335,common_gen-validation-335,335,"['clap', 'crowd', 'hand']",a man in the crowd claps with the hands,"['a man in the crowd claps with the hands', 'One by one, the crowd began to clap their hands', 'The boy in the crowd was clapping so hard that he hurt his hands.', 'the crowd of people are clapping their hands']"
common_gen-validation-336,common_gen-validation-336,336,"['boat', 'move', 'water']",The boat moves along the water.,"['The boat moves along the water.', 'The boat could move quickly on water.', 'The boat moves on the water.', 'fast moving boat on the water']"
common_gen-validation-337,common_gen-validation-337,337,"['beer', 'glass', 'hold']",The man holds his beer glass at the party.,"['The man holds his beer glass at the party.', 'A man holds his beer on the glass.', 'A girl is holding a glass of beer and dancing in the party.', 'man holding a glass of beer']"
common_gen-validation-338,common_gen-validation-338,338,"['door', 'open', 'slide']",I can slide the door open.,"['I can slide the door open.', 'The girl slid the door open to let the dog in.', 'The new homeowner requested a patio door that slides open.', 'with the sliding doors opened up']"
common_gen-validation-339,common_gen-validation-339,339,"['bed', 'look', 'sit']",The girl was sitting in the couch and looking at a bed in a catalog.,"['The girl was sitting in the couch and looking at a bed in a catalog.', 'the woman look at her bed as she sits.', 'The man sat on the bed and looked out the window', 'Looking dejected, someone sits on his bed.']"
common_gen-validation-340,common_gen-validation-340,340,"['car', 'look', 'window']","If you look through the window of a moving car, you could get disoriented.","['If you look through the window of a moving car, you could get disoriented.', 'The woman did not look out the car window before she made a turn.', 'the car looks great from the window', 'dog looking out the window of a car']"
common_gen-validation-341,common_gen-validation-341,341,"['crowd', 'jump', 'watch']",The people in the bleachers watch the cheerleaders jump up and down in front of the crowd.,"['The people in the bleachers watch the cheerleaders jump up and down in front of the crowd.', 'When the batsman hit the ball for a six, one person among the crowd watching the play jumped out to catch the ball.', 'The crowd jumped in excitement while watching the world series.', 'A crowd watches as someone runs the track and jumps.']"
common_gen-validation-342,common_gen-validation-342,342,"['couch', 'lay', 'sleep']",The boy laid on the couch and went to sleep.,"['The boy laid on the couch and went to sleep.', 'The man lays on the couch and sleeps.', 'A man is laying on the couch sleeping.']"
common_gen-validation-343,common_gen-validation-343,343,"['hold', 'stand', 'table']",He took a hold of the leg stand of the table,"['He took a hold of the leg stand of the table', 'Reid stood on the table to hold the light in place.', 'A table stands solidly and holds a bowl of fruit.', 'baby standing and holding on to a table']"
common_gen-validation-344,common_gen-validation-344,344,"['court', 'hoop', 'shoot']",He shoots the ball straight into the hoop and the entire court goes wild.,"['He shoots the ball straight into the hoop and the entire court goes wild.', 'My friends and i went to the court to shoot some hoops', 'A man shoots hoops on the basketball court to practice his game.', 'shoot hoops on the basketball court']"
common_gen-validation-345,common_gen-validation-345,345,"['climb', 'kid', 'ladder']",A kid climbs a ladder to picks some apples from a tree.,"['A kid climbs a ladder to picks some apples from a tree.', 'The kid was scared to climb the ladder.', 'Propping the ladder against the wall, the kid climbed onto the roof of his home.', 'A kid climbs a ladder.']"
common_gen-validation-346,common_gen-validation-346,346,"['concrete', 'pour', 'truck']",The truck poured the concrete onto the pavement.,"['The truck poured the concrete onto the pavement.', 'The guy used concrete to pour on the road so he can drive his truck.', 'The truck poured concrete.', 'Two men pouring concrete onto another truck.']"
common_gen-validation-347,common_gen-validation-347,347,"['drive', 'scooter', 'street']",A man drives a scooter down the street.,"['A man drives a scooter down the street.', 'The woman drives down the street with her scooter.', 'I took the scooter and go to the street for long drive.', 'scooter driving down main street']"
common_gen-validation-348,common_gen-validation-348,348,"['pass', 'player', 'puck']",The player passes the puck in the hockey game.,"['The player passes the puck in the hockey game.', 'The player passes the puck to another player.', 'The hockey player passes the puck.']"
common_gen-validation-349,common_gen-validation-349,349,"['ball', 'teammate', 'throw']",Michael threw the ball to his open teammate.,"['Michael threw the ball to his open teammate.', 'The teammates threw the ball to each other.', 'My teammate throws the ball at me.', 'One girl throws a ball to a teammate.']"
common_gen-validation-350,common_gen-validation-350,350,"['fix', 'hair', 'mirror']",The woman fixed her hair whilst looking in the mirror.,"['The woman fixed her hair whilst looking in the mirror.', 'A girl wanted to fix her hair using a mirror.', 'The lady looks into the mirror and fixes her hair.', 'Two men are fixing their hair in a mirror']"
common_gen-validation-351,common_gen-validation-351,351,"['body', 'front', 'water']",Water covered the front of a boy's body.,"[""Water covered the front of a boy's body."", 'The front of my body was cold when it was facing the fountain because the water was cold.', 'A body of water was located at the front of the house.', 'yoga in front of a body of water']"
common_gen-validation-352,common_gen-validation-352,352,"['calf', 'cowboy', 'lasso']",The cowboy has to lasso the calf quickly.,"['The cowboy has to lasso the calf quickly.', 'The Cowboy used a lasso to capture the escaped calf.', 'A cowboy lassos a calf.', 'A cowboy is attempting to lasso a calf']"
common_gen-validation-353,common_gen-validation-353,353,"['dance', 'front', 'lady']",The lady danced in front of the crowd like no one was watching.,"['The lady danced in front of the crowd like no one was watching.', 'The lady will dance in front.', 'The lady that danced in the front is very talented.', 'indian ladies dancing in front of crowd']"
common_gen-validation-354,common_gen-validation-354,354,"['paint', 'paint', 'picture']",The artist uses paint to paint a picture.,"['The artist uses paint to paint a picture.', 'A boy wanted to paint a picture with paint.', 'Sally painted a picture with the paint', 'A small girl with face paint paints a picture outside.']"
common_gen-validation-355,common_gen-validation-355,355,"['hill', 'kid', 'slide']",The kids are sliding down the hill.,"['The kids are sliding down the hill.', 'A kid slides down the hill.', 'A kid slides down a hill on a sleigh.', 'The kids slid down the hill.']"
common_gen-validation-356,common_gen-validation-356,356,"['direct', 'policeman', 'traffic']",The policeman directs traffic during rush hour.,"['The policeman directs traffic during rush hour.', 'The policeman directs traffic when there is a power outage affecting the street lights.', 'A policeman is directing traffic.', 'A policeman is directing traffic.']"
common_gen-validation-357,common_gen-validation-357,357,"['climb', 'look', 'tree']","as he climbed up the tree, he looked down in fear","['as he climbed up the tree, he looked down in fear', 'The child climbed up the tree to look at the sunset.', 'The girl climbed up the tree as the boy looked on.', 'looking up at a child climbing a tree .']"
common_gen-validation-358,common_gen-validation-358,358,"['horse', 'ride', 'time']",The jockey will ride the horse one time around the track.,"['The jockey will ride the horse one time around the track.', ""It's time to ride the horse."", 'horse ride the time stop', 'a girl rides a horse for the first time']"
common_gen-validation-359,common_gen-validation-359,359,"['listen', 'sit', 'talk']",the woman friends sit and talk as she listens to them.,"['the woman friends sit and talk as she listens to them.', 'The person was sitting and listening to someone talk.', 'The man told the boy to sit down and listen to him talk.', 'People sitting on the ground listening to someone talk.']"
common_gen-validation-360,common_gen-validation-360,360,"['chair', 'eat', 'toddler']",The toddler ate food whilst in his chair.,"['The toddler ate food whilst in his chair.', 'A toddler is able to eat at the table when an adult places a booster seat in a chair.', 'The toddler is told to sit in the chair while eating.', 'A toddler eating mushy food in a high chair.']"
common_gen-validation-361,common_gen-validation-361,361,"['car', 'stop', 'street']",A car stops on the street at the stop sign.,"['A car stops on the street at the stop sign.', 'The fast moving car stopped in the street', 'A car stops in the street to allow a pedestrian to walk across the street safely.', 'a street at night, stop lights and cars.']"
common_gen-validation-362,common_gen-validation-362,362,"['climb', 'rope', 'waterfall']",The monkey climbs the rope hanging from the waterfall,"['The monkey climbs the rope hanging from the waterfall', 'The hikers had to climb the rope to get to the waterfall.', 'The stuntman carefully climbed himself on a rope that stretched across the two shores of waterfall.', 'The woman climbed the waterfall with the red rope.']"
common_gen-validation-363,common_gen-validation-363,363,"['perform', 'routine', 'team']",Team Sakura performed the weekly routine on Saturday at 10:00 am.,"['Team Sakura performed the weekly routine on Saturday at 10:00 am.', 'The boys dance team was going to perform their routine for the competition.', 'The team was performing their routine training.', 'the football team performs a dance routine during the saturday .']"
common_gen-validation-364,common_gen-validation-364,364,"['shirt', 'tie', 'wear']",The man wear shirt and tie for an interview.,"['The man wear shirt and tie for an interview.', 'For the wedding the men wear shirts with ties.', 'a person wearing a a shirt and tie ']"
common_gen-validation-365,common_gen-validation-365,365,"['board', 'fall', 'ride']",The boy carrying the white board fell over while riding the bicycle.,"['The boy carrying the white board fell over while riding the bicycle.', 'He falls off the board when he rides it.', 'The boys will ride the board and do not want to fall off.', 'A person riding a snow board trying not to fall.']"
common_gen-validation-366,common_gen-validation-366,366,"['horse', 'ride', 'river']",The man rode the horse to the shallow river.,"['The man rode the horse to the shallow river.', 'The rider rode the horse through the river.', 'The woman daily rides a horse to tge river nile.', 'horse riding on the river']"
common_gen-validation-367,common_gen-validation-367,367,"['lap', 'sit', 'toddler']",A toddler can sit on the lap of his mother.,"['A toddler can sit on the lap of his mother.', 'The toddler sat in my lap.', ""The toddler sits in his mother's lap."", ""Two toddlers sitting in mom's lap.""]"
common_gen-validation-368,common_gen-validation-368,368,"['car', 'hose', 'wash']",The man washes his car with a hose.,"['The man washes his car with a hose.', 'The boy washes the car with a hose.', 'A girl washed her car with the garden hose.', 'boy washing a car with a garden hose .']"
common_gen-validation-369,common_gen-validation-369,369,"['floor', 'leg', 'sit']",The person's leg touched the floor when he sat down.,"[""The person's leg touched the floor when he sat down."", 'A boy folds his legs and sits on the floor.', 'sit on your leg to the floor', 'A dog sitting on the floor between a person legs ']"
common_gen-validation-370,common_gen-validation-370,370,"['arm', 'hand', 'raise']",I raised my arm so the teacher would notice my hand was up,"['I raised my arm so the teacher would notice my hand was up', 'The boy found it difficult to raise his hand without hurting the arm.', ""The boy's arm is tired from raising his hand to answer a question."", 'A young boy wearing costume hands raises his arms.']"
common_gen-validation-371,common_gen-validation-371,371,"['fly', 'spark', 'weld']",Sparks will fly when you weld.,"['Sparks will fly when you weld.', 'While welding pieces of iron for preparing an iron gate, the welder guarded himself against the flying sparks.', 'Sparks fly as the man welds.', 'Sparks fly as he welds.']"
common_gen-validation-372,common_gen-validation-372,372,"['head', 'shirt', 'wear']",The woman pulled the shirt she was going to wear over her head to get it on,"['The woman pulled the shirt she was going to wear over her head to get it on', 'The woman wears the shirt over her head.', 'The boy pulls the shirt he wants to wear over his head.', 'A woman in a green shirt wears a hat on her head.']"
common_gen-validation-373,common_gen-validation-373,373,"['fold', 'hand', 'stand']",A boy folds a hand towel while standing.,"['A boy folds a hand towel while standing.', 'I will stand as i use my hands to fold the clothes.', 'why stand and fold your hand?', 'Nearby someone stands with her hands folded.']"
common_gen-validation-374,common_gen-validation-374,374,"['perform', 'routine', 'skater']",the routine of a skater consists in performing,"['the routine of a skater consists in performing', 'figure skater performs a routine .']"
common_gen-validation-375,common_gen-validation-375,375,"['chair', 'floor', 'sit']","If a woman wants to sit down, the woman can sit on a chair or on the floor.","['If a woman wants to sit down, the woman can sit on a chair or on the floor.', 'He sat on the chair that was in the middle of the floor.', 'A dog sits on the floor next to a chair.']"
common_gen-validation-376,common_gen-validation-376,376,"['bull', 'crowd', 'ride']",Whenever the cowboys ride bulls at the county fair the crowd goes wild.,"['Whenever the cowboys ride bulls at the county fair the crowd goes wild.', 'The evil bull rider rode the bull into the crowd.', 'The man rides the bull in front of the crowd.', 'A man rides a bull in front of a crowd.']"
common_gen-validation-377,common_gen-validation-377,377,"['prepare', 'race', 'run']","The woman prepares to race, she gets ready to run.","['The woman prepares to race, she gets ready to run.', 'The girl prepared to run the race.', 'The girl practiced the run to prepare for the race.', 'A person prepares to run a race.']"
common_gen-validation-378,common_gen-validation-378,378,"['game', 'part', 'take']",The friends take part in a fun board game.,"['The friends take part in a fun board game.', 'The man had to take his turn as part of the game.', 'All of the boys took part in the game.', 'players taking part in a walking football game']"
common_gen-validation-379,common_gen-validation-379,379,"['baseball', 'field', 'team']",The team plays baseball in a new field,"['The team plays baseball in a new field', 'The team played baseball on the field.', 'The baseball team spent all day out on the field practicing for the big game.', 'Two teams play baseball in a field.']"
common_gen-validation-380,common_gen-validation-380,380,"['book', 'look', 'toddler']",The toddler looks at the book.,"['The toddler looks at the book.', 'My toddler will look at his favorite book when he is getting tired', 'A toddler looks at a book.', 'Toddlers look at a book.']"
common_gen-validation-381,common_gen-validation-381,381,"['hold', 'phone', 'walk']",The teenager was going to put her walk on hold so she could find her phone.,"['The teenager was going to put her walk on hold so she could find her phone.', 'The girl could not hold the phone and walk with the dog at the same time.', 'As we were walking, my friend was holding her phone in her purse.', 'an Amish  man walking holding a cell phone']"
common_gen-validation-382,common_gen-validation-382,382,"['drive', 'hat', 'wear']",The man wore a hat whilst he drove the car.,"['The man wore a hat whilst he drove the car.', 'I like to wear a hat while I drive.', 'wearing a hat on a drive convertible is useless', 'A man wearing a hat is driving a car.']"
common_gen-validation-383,common_gen-validation-383,383,"['cut', 'piece', 'tool']",A lady used a scissors as a tool to cut a piece of thread.,"['A lady used a scissors as a tool to cut a piece of thread.', 'The tool cut a small piece.', 'The girl cut a piece with a tool.', 'someone chipped away a piece of a stone cutting tool']"
common_gen-validation-384,common_gen-validation-384,384,"['pool', 'suit', 'swim']",The boy needed a swim suit to go to the pool party.,"['The boy needed a swim suit to go to the pool party.', 'Several adults in red suits swimming with children in a pool.']"
common_gen-validation-385,common_gen-validation-385,385,"['food', 'plate', 'sit']",I sit down to eat my plate of food.,"['I sit down to eat my plate of food.', 'The boy sat and picked at the food on his plate.', 'grad yoy plate of food and sit', 'A plate of food sits on a mat.']"
common_gen-validation-386,common_gen-validation-386,386,"['cook', 'kitchen', 'pan']",The cook forgot to bring the extra pan to the kitchen.,"['The cook forgot to bring the extra pan to the kitchen.', 'The man was in the kitchen cooking eggs on a pan', 'man cooking with a pan in a commercial kitchen.']"
common_gen-validation-387,common_gen-validation-387,387,"['blow', 'candle', 'cupcake']",The child blew the candles out on the birthday cupcake.,"['The child blew the candles out on the birthday cupcake.', 'He blew out the candle on the cupcake.', 'The boy blew out the candle on the cupcake.', 'A man blowing out candles on a cupcake.']"
common_gen-validation-388,common_gen-validation-388,388,"['ball', 'game', 'gym']",We need a ball to play the soccer game in the gym.,"['We need a ball to play the soccer game in the gym.', 'The students throw the ball in the game in the gym.', 'People in a gym are playing a game involving balls']"
common_gen-validation-389,common_gen-validation-389,389,"['ball', 'golfer', 'hole']",A golfer putts a ball into a hole.,"['A golfer putts a ball into a hole.', 'The golfer hit the golf ball straight into the hole.', 'It took the golfer six times to get the ball in the hole.', 'golfer putting the ball into the hole']"
common_gen-validation-390,common_gen-validation-390,390,"['cover', 'snow', 'street']",The street was covered in snow.,"['The street was covered in snow.', 'Snow falls and covers the street.', 'In the winter the streets are often covered in snow.', 'snow covered street in front']"
common_gen-validation-391,common_gen-validation-391,391,"['mat', 'perform', 'routine']",The girl performs her routine on the mats in the gym.,"['The girl performs her routine on the mats in the gym.', 'A routine is performed on a mat.', 'The girl performs her gymnastics routine on a mat.', 'Two men are performing gymnastic routines on a blue mat.']"
common_gen-validation-392,common_gen-validation-392,392,"['eat', 'food', 'front']",In the front yard we eat food at our bbq.,"['In the front yard we eat food at our bbq.', 'I eat food in the front porch.', 'As he sat in the front of the lobby he looked at the available food and began to eat.', 'Two people eating food in front of a store']"
common_gen-validation-393,common_gen-validation-393,393,"['costume', 'stage', 'stand']",The boy is on the stage in his costume behind the music stand.,"['The boy is on the stage in his costume behind the music stand.', 'An actor wears a costume while performing on stage as he stands.', 'I stood on the stage to be judged for the costume contest.', 'Women in costume stand on a stage.']"
