gem_id,gem_parent_id,concept_set_id,concepts,target,references
common_gen-validation-767,common_gen-validation-767,767,"['building', 'car', 'park', 'street', 'walk']",You can walk easily in the streets if the cars are parked in the building courtyard.,"['You can walk easily in the streets if the cars are parked in the building courtyard.', 'Parking the car, the businessman crosses the street and walks into the building.', 'I parked on the street and walked from the car to the building.', 'A girl walks down the street to where her car is parked next to the building.', 'You park your car on the street in front of the building and walk inside.', 'If you walk around the building to the street, that is where the car is parked.', 'I park my car on the street and walk to the building.', 'A sunny street with a red building, parked cars, and a man walking down the road.']"
common_gen-validation-768,common_gen-validation-768,768,"['bowl', 'chair', 'eat', 'food', 'sit']",The boy sits in his chair and eats the food in his bowl.,"['The boy sits in his chair and eats the food in his bowl.', 'The boy sits on the chair to eat food in a bowl', 'A man sits in a chair holding the bowl while eating his food.', 'An older man sitting on a chair and eating food from a bowl']"
common_gen-validation-769,common_gen-validation-769,769,"['chair', 'clap', 'hand', 'sit', 'talk']","The man was sitting in the chair, clapping his hands while talking about his crazy day.","['The man was sitting in the chair, clapping his hands while talking about his crazy day.', 'A little girl sitting in a high chair is talking and clapping her hands.']"
common_gen-validation-770,common_gen-validation-770,770,"['blow', 'bubble', 'chew', 'gum', 'pop']",A girl blows and pops bubbles while chewing her gum.,"['A girl blows and pops bubbles while chewing her gum.', 'I blew a big bubble while chewing gum and then the bubble went pop.', 'A boy blows and pops bubbles while chewing gum', 'Ann is chewing the gum to blow a bubble until it pops.', 'A woman chewing gum blows a bubble until it pops.']"
common_gen-validation-771,common_gen-validation-771,771,"['bridesmaid', 'dress', 'help', 'receive', 'wear']",The bridesmaid wears a dress and helps the bride receive the ring.,"['The bridesmaid wears a dress and helps the bride receive the ring.', ""The woman receives a friend's help to wear the bridesmaid dress."", 'The bridesmaid needs help wearing the dress she received.', 'Bride wearing her wedding dress receives help by her bridesmaids wearing red dresses.']"
common_gen-validation-772,common_gen-validation-772,772,"['object', 'river', 'stand', 'throw', 'water']",stand near the river and throw the object into the water,"['stand near the river and throw the object into the water', 'The boys can stand at the edge of the river to throw objects into the water.', 'A boy stood in the river and threw an object into the water.', 'A boy stands near a river, he aims and throw an object across the water.']"
common_gen-validation-773,common_gen-validation-773,773,"['ball', 'dog', 'grass', 'mouth', 'run']",The dog runs on the grass and catches the ball in its mouth.,"['The dog runs on the grass and catches the ball in its mouth.', 'The dog run through the grass with a mouth full of the ball.', 'The dog ran across the grass carrying the ball in his mouth.', 'A dog running across the grass with a ball in its mouth.']"
common_gen-validation-774,common_gen-validation-774,774,"['car', 'drive', 'line', 'line', 'street']",A man drives his car down the street between the yellow center line and the white side line.,"['A man drives his car down the street between the yellow center line and the white side line.', 'Cars line the streets as people drive in a line.', 'The woman drives a car down the street alongside the white lines and according the market stalls that line the street.', 'Power lines are driving down a street lined with cars']"
common_gen-validation-775,common_gen-validation-775,775,"['discuss', 'phone', 'protect', 'water', 'way']",Discuss the way hoe we can protect our phone from  water shedding.,"['Discuss the way hoe we can protect our phone from  water shedding.', 'I will call you on the phone to discuss how we can protect the way to the water.', 'On the phone, we discussed a way to protect children playing in the water.', 'The two friends discuss on the phone the best way to protect the computer from water.', 'I would like you to discuss with the man on the phone how the state can protect the water way.', 'A group of people discuss ways to protect a cell phone from water.']"
common_gen-validation-776,common_gen-validation-776,776,"['ball', 'chase', 'dog', 'owner', 'throw']",The owner throws the ball so his dog can chase it.,"['The owner throws the ball so his dog can chase it.', 'The owner threw the ball for the dog to chase after.', 'The girl watched the owner of the dog throw the ball for it to chase.', 'A dog chases the ball its owner threw.']"
common_gen-validation-777,common_gen-validation-777,777,"['arm', 'down', 'gym', 'perform', 'pull']",A man uses his arm to pull down a cable in the gym while performing exercise.,"['A man uses his arm to pull down a cable in the gym while performing exercise.', 'The athlete uses one arm to pull down and dismount the pommel horse after performing a routine in the gym.', 'A girl went down to the gym to perform arm pull workouts.', 'A guy performs weight pull downs in a gym by pulling his arms down.']"
common_gen-validation-778,common_gen-validation-778,778,"['couple', 'hand', 'hold', 'street', 'walk']",A couple hold hands while walking down the street.,"['A couple hold hands while walking down the street.', 'The couple wanted to hold each others hand while they walked down the street', 'The couple looked cute holding hands walking down the street.', 'A couple holding hands walks down a street.']"
common_gen-validation-779,common_gen-validation-779,779,"['discuss', 'pipe', 'type', 'use', 'wood']",We discuss the type of pipe to use instead of wood.,"['We discuss the type of pipe to use instead of wood.', 'The design team consisting of two men and one woman discussed the design of a wood pipe as part of their design assissment, they then used their computer to type in the design dementions and their thoughts on the pipe design for their assignment.', 'The men discuss the type of wood to use when making a pipe.', 'A man discusses the best type of wood to use when making a pipe.']"
common_gen-validation-780,common_gen-validation-780,780,"['hand', 'sink', 'soap', 'wash', 'water']",hands must be washed in sink with soap and water before returning to work,"['hands must be washed in sink with soap and water before returning to work', 'A girl is at a sink to wash her hands with soap and water.', 'To keep germs down, please go to the sink and use soap washing your hands under the water.', 'I turned on the water and used soap to wash my hands in the sink.', 'People put soap on their hands and wash with water at sinks.']"
common_gen-validation-781,common_gen-validation-781,781,"['card', 'deck', 'hand', 'hold', 'shuffle']",A boy holds deck of cards in his hand and is ready to shuffle them.,"['A boy holds deck of cards in his hand and is ready to shuffle them.', 'The man holds his hand after the dealer shuffled the deck because he likes his card.', 'The man shuffles the deck of cards, then deals five cards and holds them in his hand.', 'A person holding and shuffling a deck of cards in one hand']"
common_gen-validation-782,common_gen-validation-782,782,"['audience', 'front', 'microphone', 'sing', 'sit']",The woman stood at the microphone at the front of the stage and began to sing to the audience sitting in the stadium.,"['The woman stood at the microphone at the front of the stage and began to sing to the audience sitting in the stadium.', 'The woman stands on the stage and sings into the microphone in front of the audience that sits on chairs.', 'The audience sat in front of the singer who sang into the microphone.', 'A man sits at a piano and sings into a microphone in front of an audience.']"
common_gen-validation-783,common_gen-validation-783,783,"['floor', 'motorcycle', 'oil', 'pour', 'sit']",The man poured oil into the motorcycle sitting on the floor.,"['The man poured oil into the motorcycle sitting on the floor.', 'A man sat on the floor as the oil poured out of the motorcycle.', 'the man was sitting down on the floor while he poured motorcycle oil into his motorcycle.', 'A man is sitting on the floor next to a motorcycle, and pours new motor oil into it.']"
common_gen-validation-784,common_gen-validation-784,784,"['eat', 'hand', 'stand', 'table', 'watermelon']",The teenage girl stood a the table eating watermelon with her hands.,"['The teenage girl stood a the table eating watermelon with her hands.', 'Everyone would stand at the table to eat the watermelon with their hand at the fair.', 'The woman stands at the table where her family eats watermelon with their clean hands.', 'Men are standing around a table and bend over to eat watermelon without using their hands.']"
common_gen-validation-785,common_gen-validation-785,785,"['blow', 'blower', 'leave', 'use', 'yard']",The man was using a leaf blower to blow the leaves into a pile in the yard.,"['The man was using a leaf blower to blow the leaves into a pile in the yard.', 'I use the blower in the yard to blow the leaves.', 'The man used a leaf blower to blow snow out of his yard so that his wife could leave home.', 'The man uses his leaf blower to blow the leaves from the yard.', 'A blower is used to blow leaves from a yard', 'Out in a yard, a man uses a blower to blow leaves.']"
common_gen-validation-786,common_gen-validation-786,786,"['bike', 'fall', 'jump', 'ramp', 'ride']",A boy falls riding his bike when he tried to jump on a ramp.,"['A boy falls riding his bike when he tried to jump on a ramp.', 'A boy wanted to ride up a bike ramp, but instead he did a jump and fell.', 'The boy rode his bike down a hill to jump a ramp, but missed and fell.', 'Someone is riding a small bike, jumps off a ramp, and falls.']"
common_gen-validation-787,common_gen-validation-787,787,"['face', 'foot', 'laugh', 'say', 'stick']",The girl says that faces start laughing as the feet stick together and fall.,"['The girl says that faces start laughing as the feet stick together and fall.', 'The man said he laughed when he tripped over my foot that was sticking out and fell on his face.', '""She stuck her foot in my face and laughed at me"", he said.', 'A little girl keeps sticking her feet into a mans face as he says oh and she laughs.']"
common_gen-validation-788,common_gen-validation-788,788,"['ball', 'knock', 'lane', 'pin', 'throw']",The man threw the ball down the lane to knock down all of the pins.,"['The man threw the ball down the lane to knock down all of the pins.', 'Bowling is where you throw a ball down the lane and knock over pins.', 'A bowling ball is thrown down a bowling lane and knocks over 7 pins.', 'The man throw the bowling ball done the lane and knocked over pins.', 'At a bowling lane a ball is thrown and knocks down all the pins.']"
common_gen-validation-789,common_gen-validation-789,789,"['concert', 'place', 'stage', 'take', 'watch']",Take the boy to the place with the concert and watch the band on the stage.,"['Take the boy to the place with the concert and watch the band on the stage.', 'People in the crowd watch a concert taking place on a stage.', 'I like to watch a concert take place on the stage.', 'The concert takes place on a stage while the crowd watches.', 'A large crowd of people watch the stage as an outside concert takes place.']"
common_gen-validation-790,common_gen-validation-790,790,"['dog', 'field', 'frisbee', 'perform', 'trick']",The dog performs tricks in the field with a frisbee.,"['The dog performs tricks in the field with a frisbee.', 'He took his dog to the field to perform tricks with a frisbee.', 'The dog performs a trick with a frisbee in the field.', 'A man is shown on a field performing tricks with a dog and a bunch of frisbees.']"
common_gen-validation-791,common_gen-validation-791,791,"['cover', 'graffiti', 'stand', 'wall', 'wear']",The man wears a hood as he stands and covers a wall with graffiti.,"['The man wears a hood as he stands and covers a wall with graffiti.', 'The man stands by a wall, wearing a mask to cover his face while he tags graffiti', 'The man wore a uniform and stood to clean wall covered with graffiti.', 'A man wearing a red backpack is standing next to a graffiti covered wall.']"
common_gen-validation-792,common_gen-validation-792,792,"['dog', 'hold', 'mouth', 'stick', 'water']",The dogs jumped in the water and held the stick in his mouth.,"['The dogs jumped in the water and held the stick in his mouth.', 'The dog held the stick in his mouth while swimming in the water.', ""The owner took the stick from the dog's mouth to hold it while he drank some water."", 'A dog in water holds a stick in its mouth.']"
common_gen-validation-793,common_gen-validation-793,793,"['beer', 'drink', 'glass', 'shirt', 'wear']",The man wears a shirt whilst he drinks his glass of beer.,"['The man wears a shirt whilst he drinks his glass of beer.', 'He spilled the beer from his drink glass all over the shirt he decided to wear.', ""The man wears a green shirt while he drinks beer from a glass on St. Patrick's Day."", ""I went to drink a glass of beer down at the pub, but I couldn't find a clean shirt to wear."", 'Man wearing glasses with a shirt drinks beer']"
common_gen-validation-794,common_gen-validation-794,794,"['birthday', 'blow', 'cake', 'candle', 'sing']",The boy blew out the candles on his birthday cake after his parents sang Happy Birthday.,"['The boy blew out the candles on his birthday cake after his parents sang Happy Birthday.', 'I watched my friend blow the candles out on her birthday cake while her friends sing to her.', 'The group of kids all sing ""Happy Birthday"" before the birthday boy blows out the candles on the cake.', 'The family sings happy birthday as the boy blows out the candles on the cake.', 'Young kids sing happy birthday and blow out candles on their cake.']"
common_gen-validation-795,common_gen-validation-795,795,"['bartender', 'bottle', 'drink', 'pour', 'toss']",The bartender picks the bottle and toss it and pour the drink in the glass.,"['The bartender picks the bottle and toss it and pour the drink in the glass.', 'The bartender took the bottle to pour a drink, but had to toss it because it was empty.', 'The bartender poured a drink from the bottle after tossing it in the air.', 'A bartender is tossing a bottle all around before pouring a drink.']"
common_gen-validation-796,common_gen-validation-796,796,"['break', 'check', 'phone', 'ride', 'take']",The woman took a break from her ride in her car to stop at a rest stop to check her phone.,"['The woman took a break from her ride in her car to stop at a rest stop to check her phone.', 'The man took a break and checked his phone before riding in his car.', 'During his break, my friend checks his phone to see how long it will take to get a ride home.', 'During my work break I will ride the bus, take my phone and check stock prices.', 'Someone takes a break from riding to check their phone.']"
common_gen-validation-797,common_gen-validation-797,797,"['apple', 'bag', 'pick', 'put', 'tree']",I picked an apple from the tree and put it in my bag.,"['I picked an apple from the tree and put it in my bag.', 'When we went apple picking we had to put all the apples we picked off the trees into a bag.', 'A boy picks some apples from a tree and puts them into a bag.', 'The group of boys were picking apples from  the tree and putting them in the bag.', 'A baby is picking apples from a tree and putting them in a bag.']"
common_gen-validation-798,common_gen-validation-798,798,"['ball', 'net', 'shoot', 'take', 'turn']","A teenager was about to take his turn, when he shoot the ball towards the net.","['A teenager was about to take his turn, when he shoot the ball towards the net.', 'I take the ball, turn, and shoot into the back of the net.', 'A player shot a ball above the net and it took a turn in the match.', 'The basketball was able to take the ball away turn around and shoot the ball through the net at the last second.', 'A girls soccer team takes turns shooting the ball at the net.']"
common_gen-validation-799,common_gen-validation-799,799,"['clip', 'follow', 'game', 'graphic', 'number']","We played a game on the movie clip, it was called follow the graphic number!","['We played a game on the movie clip, it was called follow the graphic number!', 'The clip that follows the game includes a graphic and a number.', 'I played the graphic clip of number 4 tackling the other play in the game following the bad call.', 'A graphic shows the number 9 followed by clips from a hockey game.']"
common_gen-validation-800,common_gen-validation-800,800,"['bike', 'helmet', 'ride', 'shirt', 'wear']",A girl ride a bike and wear a shirt and a helmet,"['A girl ride a bike and wear a shirt and a helmet', 'Wearing his favorite shirt, the boy put on his helmet, got on his bike, and rode away.', 'A boy puts on his helmet and rides his bike to the store to find a new shirt to wear.', 'Two men wearing white shirts wearing helmets while riding a bike.']"
common_gen-validation-801,common_gen-validation-801,801,"['hand', 'rinse', 'run', 'tap', 'water']","For clean hands, run hands under the tap and use water to rinse hands.","['For clean hands, run hands under the tap and use water to rinse hands.', 'The girl rinses her hands under the running tap water.', 'The lady used the tap on the faucet to run the water and rinse her hand.', 'A person rinsed her hand under the water running from the tap']"
common_gen-validation-802,common_gen-validation-802,802,"['mask', 'paint', 'roller', 'wall', 'wear']",A man wore the mask while he painted the wall with the roller.,"['A man wore the mask while he painted the wall with the roller.', 'A girl wears a mask while using a paint roller to paint a wall.', 'A woman wears a mask while painting with a roller on a wall.', 'Please use the roller paint on the mask so you can wear it or hang it on the wall.', 'Man paints a wall white with a long roller wearing a mask.']"
common_gen-validation-803,common_gen-validation-803,803,"['bottle', 'fill', 'hold', 'liquid', 'machine']",The woman holds the empty water bottle under the machine to fill it with liquid.,"['The woman holds the empty water bottle under the machine to fill it with liquid.', 'A machine fills a bottle with liquid as a man holds on tight.', 'The woman held a bottle and filled it with liquid dispensed by a machine.', 'Workers hold plastic bottles up to a machine that fills them with liquid.']"
common_gen-validation-804,common_gen-validation-804,804,"['blow', 'hand', 'hold', 'instrument', 'sit']",A man sits holding an instrument in his hands and blows it.,"['A man sits holding an instrument in his hands and blows it.', 'The girl sits as she holds the instrument in her hand and blows into the mouthpiece.', 'The musician sits and blows into the instrument he holds in his hand.', 'A man is sitting down blowing into a hand held musical instrument.']"
common_gen-validation-805,common_gen-validation-805,805,"['hand', 'hold', 'lock', 'pick', 'tool']",The locksmith holds the pick in one hand and uses the tool to open the lock.,"['The locksmith holds the pick in one hand and uses the tool to open the lock.', 'The thief is holding a tool used to pick a lock in his right hand.', 'The locksmith holds the tool to pick the lock in his hand.', 'A woman holds a lock in her hand and picks it with some tools.']"
common_gen-validation-806,common_gen-validation-806,806,"['flag', 'gun', 'hold', 'shoot', 'stand']",The man stands by a flag holds his gun and shoots.,"['The man stands by a flag holds his gun and shoots.', 'Under a flag, a person holds a gun and shoots while standing.', 'A man standing near the flag hold a gun and shoot at the air', 'Civl war reenactors stand together holding flags and shooting fake guns.']"
common_gen-validation-807,common_gen-validation-807,807,"['laugh', 'paper', 'piece', 'rip', 'sit']",The student laughed when the piece of paper ripped when sitting down.,"['The student laughed when the piece of paper ripped when sitting down.', 'My friends who sit near me, rip a piece of paper from my book and laughs hard badly', 'The teacher laughed as he ripped a piece of paper while the students sat.', 'A baby is sitting in a chair and laughs when a woman rips a piece of paper.']"
common_gen-validation-808,common_gen-validation-808,808,"['ball', 'catch', 'dog', 'leg', 'stand']",The dog hurt his leg trying to catch a ball and now he cannot stand on it.,"['The dog hurt his leg trying to catch a ball and now he cannot stand on it.', 'A dog catches a ball while standing on its hind legs.', 'A dog stands on its legs and catches a ball.', 'A dog stands on his hind legs to catch a ball.']"
common_gen-validation-809,common_gen-validation-809,809,"['ear', 'glove', 'pierce', 'sit', 'wear']",The woman who pierces ears should wear protective gloves and have the person sit when piercing ears..,"['The woman who pierces ears should wear protective gloves and have the person sit when piercing ears..', 'Before you sit, make sure you are wearing gloves then you can pierce the ear.', 'When a person gets their ears pierced, they sit in a chair and a professional wearing gloves prepares them.', 'People should wear gloves while piercing ears, prior to the customer sitting down.', 'A young girl is sitting down while someone wearing gloves pierces her ear']"
common_gen-validation-810,common_gen-validation-810,810,"['chair', 'clipper', 'cut', 'hair', 'sit']",Sit in the chair to get your hair cut with clippers.,"['Sit in the chair to get your hair cut with clippers.', 'The Barber uses a clipper to cut the hair of the customer sitting in the chair', 'A man was asked to sit on the chair, so she could use the clipper to cut his hair.', 'A young man sits in a chair while his hair is cut with clippers']"
common_gen-validation-811,common_gen-validation-811,811,"['ball', 'hit', 'hold', 'racket', 'room']",A boy holding a racket hits a ball across the room.,"['A boy holding a racket hits a ball across the room.', 'The man holds a racket that he uses to hit the ball across the room.', 'A boy holding a racket hits the ball in the room.', 'The men walk around the room holding tennis rackets and hitting a ball.']"
common_gen-validation-812,common_gen-validation-812,812,"['card', 'chip', 'deal', 'dealer', 'table']","At the dealer table, I made a deal, and i put all my chips in for a certian card.","['At the dealer table, I made a deal, and i put all my chips in for a certian card.', 'A girl goes up to a poker table and asks the dealer to deal the girl some cards and give the girl some chips too.', 'The salesman at the car dealers charged the man at the table a credit card with a chip to make a deal', 'At the poker table, the dealer deals the cards, the players bet their chips', 'People put their chips on the table and a dealer deals out cards.']"
common_gen-validation-813,common_gen-validation-813,813,"['goal', 'goalie', 'move', 'practice', 'protect']",A goalie moves backwards in a football practice to protect his net from goal.,"['A goalie moves backwards in a football practice to protect his net from goal.', 'At practice, the goalie attempted to protect the goal using a new move.', 'The goalie practices a new move to protect the net to keep the other team from scoring a goal.', 'In a hockey rink a goalie is practicing their goal protecting moves.']"
common_gen-validation-814,common_gen-validation-814,814,"['alligator', 'hold', 'mouth', 'sit', 'top']",The alligator liked to sit and hold its mouth open on top of the water.,"['The alligator liked to sit and hold its mouth open on top of the water.', 'An alligator will hold a banana that will sit on top of his mouth for two minutes before consuming it.', 'While holding on and sitting still on top of an alligator,  the bug waits for it to open its mouth.', 'I saw an alligator sitting on top of a rock holding his mouth open.', ""A woman sits on top of an alligator and holds it's mouth.""]"
common_gen-validation-815,common_gen-validation-815,815,"['car', 'cross', 'crosswalk', 'stop', 'street']",The boy stops and looks for cars before using the crosswalk to cross the street.,"['The boy stops and looks for cars before using the crosswalk to cross the street.', 'A car stops at a crosswalk while a man crosses the street.', 'A boy was crossing the road through crosswalks in the street and the car stops behind him.', 'Cars stop for people to cross the street, overflowing the crosswalk.']"
common_gen-validation-816,common_gen-validation-816,816,"['ocean', 'ride', 'surfboard', 'surfer', 'wave']",The surfer rides the wave in the ocean by standing on a surfboard.,"['The surfer rides the wave in the ocean by standing on a surfboard.', 'The surfer rode her surfboard on the ocean waves.', 'The surfer rides his surfboard over the waves in the ocean.', 'A surfer riding a wave in the ocean on a surfboard.']"
common_gen-validation-817,common_gen-validation-817,817,"['begin', 'ingredient', 'pot', 'pour', 'stir']",Begin dinner by pouring the ingredients into the pot and stir.,"['Begin dinner by pouring the ingredients into the pot and stir.', 'To begin she poured the ingredient into the pot and began to stir.', 'The grandma began cooking by cutting her ingredients then poured them into the pot and stirred them.', 'A person pours ingredients into a pot and begins to stir continuously.']"
